name,nameEn,region,city,municipality,postcode,suburb,lon,lat,address,,,,,,
Св. Димитриј Солунски,St. Demetrius of Salonica,Pelagonia Region,Oreovec,Municipality of Prilep,,,41.38937535,21.64244831,"St. Demetrius of Salonica, Prilep-Gradsko, Oreovec, North Macedonia",,,,,,
Св. Димитриј Солунски,St. Demetrius of Salonica,Pelagonia Region,Krivogashtani,Municipality of Krivogashtani,7524,,41.33761305,21.32883142,"St. Demetrius of Salonica, Filip Vtori, 7524 Krivogashtani, North Macedonia",,,,,,
Св. Теодор Тирон,St. Theodor Thiron,Pelagonia Region,Krivogashtani,Municipality of Krivogashtani,7524,,41.3359129,21.3359757,"St. Theodor Thiron, Filip Vtori, 7524 Krivogashtani, North Macedonia",,,,,,
Пресв. Богородица,Holy Mother of God,Pelagonia Region,Krivogashtani,Municipality of Krivogashtani,7524,,41.33549535,21.32925,"Holy Mother of God, Avstriska, 7524 Krivogashtani, North Macedonia",,,,,,
Св. Николај,St. Nicholas,Pelagonia Region,Krivogashtani,Municipality of Krivogashtani,7524,,41.33368935,21.331408,"St. Nicholas, Brakja Mocanoski, 7524 Krivogashtani, North Macedonia",,,,,,
Свети Никола,Saint Nicholas,Pelagonia Region,Demir Hisar,Municipality of Demir Hisar/Murgashevo,7240,,41.21980895,21.21051864,"Saint Nicholas, 11 Oktomvri, 7240 Demir Hisar, North Macedonia",,,,,,
Преображение Христово,,Southwestern Region,Mogilec,Municipality of Makedonski Brod,,,41.6625426,21.22009845,"Преображение Христово, R2132, Mogilec, North Macedonia",,,,,,
Манастир Св. Архангел Михаил,,Pelagonia Region,Skochivir,Municipality of Novaci,,,40.96980525,21.64239084,"Манастир Св. Архангел Михаил, R2338, Skochivir, North Macedonia",,,,,,
Св. Константин и Елена,Sts. Constantine and Helena,Pelagonia Region,Veselchani,Municipality of Prilep,7512,,41.26502155,21.43758725,"Sts. Constantine and Helena, A3, 7512 Veselchani, North Macedonia",,,,,,
Св. Петка,St. Parascheva,Pelagonia Region,Krushevo OT,Municipality of Krushevo,7550,Влашко Маало,41.36507975,21.2416082,"St. Parascheva, Blagoj Celev, 7550 Krushevo OT, North Macedonia",,,,,,
Св. Петар и Павле,St. Peter and Paul,Skopje Region,Skopje,Municipality of Gjorche Petrov,1060,Оризари,42.00936525,21.36199288,"St. Peter and Paul, Булевар Македонска Војска, 1060 Skopje, North Macedonia",,,,,,
Св. Злата Мегленска,,Skopje Region,Skopje,Municipality of Saraj,1060,Saraj,42.0040455,21.33293425,"Св. Злата Мегленска, Улица 20, 1060 Skopje, North Macedonia",,,,,,
Св. Спас,Church of the Holy Savior,Skopje Region,Orman,Municipality of Gjorche Petrov,,,42.07007265,21.3557092,"Church of the Holy Savior, A4, Orman, North Macedonia",,,,,,
Св. Јован Крстител,St. John The Baptist,Pelagonia Region,Krushevo OT,Municipality of Krushevo,7550,Lower Krushevo,41.36952875,21.24923957,"St. John The Baptist, Nikola Gjurkovikj, 7550 Krushevo OT, North Macedonia",,,,,,
Св. Никола,St. Nicholas,Pelagonia Region,Krushevo OT,Municipality of Krushevo,7550,Lower Krushevo,41.3683475,21.24908799,"St. Nicholas, Маршал тито, 7550 Krushevo OT, North Macedonia",,,,,,
Манастир Св. Илија,Monastery St. Elijah,Skopje Region,Banjane,Municipality of Chucher Sandevo,,,42.12994875,21.38758628,"Monastery St. Elijah, Манастир Св. Илија, Banjane, North Macedonia",,,,,,
Св. Еремија,,Skopje Region,Skopje,Municiplity of Kisela Voda,1050,Пинтија,41.94532105,21.48383337,"Св. Еремија, Саса-2, 1050 Skopje, North Macedonia",,,,,,
Sulltan Bejazit,,Southwestern Region,Kichevo,Municipality of Kichevo,6250,Chiflik,41.5146118,20.96290576,"Sulltan Bejazit, Гоце Делчев, 6250 Kichevo, North Macedonia",,,,,,
Црква Св. Кузман и Дамјан - Триангла,,Skopje Region,Skopje,Municipality of Gazi Baba,1001,Madzhari,41.9987378,21.49242741,"Црква Св. Кузман и Дамјан - Триангла, Анри Барбис, 1001 Skopje, North Macedonia",,,,,,
Св. Атанас,,Skopje Region,Dolna Matka,Municipality of Saraj,,,41.97120715,21.3101193,"Св. Атанас, Ul. 2, Dolna Matka, North Macedonia",,,,,,
Св. Никола,St. Nicholas,Pelagonia Region,Pashino Ruvci,Municipality of Krivogashtani,7525,,41.24869175,21.39484675,"St. Nicholas, Boris Trajkovski, 7525 Pashino Ruvci, North Macedonia",,,,,,
"Црква ""Пресвета Богородица""","Church ""Тhe Blessed Mother of God""",Polog Region,Gostivar,Municipality of Gostivar,1230,,41.7931916,20.91104382,"Church Тhe Blessed Mother of God""",,,"Димитар Влахов, 1230 Gostivar, North Macedonia",246171790,,
Св.Спас,Holy Saviour Church,Skopje Region,Drachevo,Municiplity of Kisela Voda,1050,,41.934994,21.5178031,"Holy Saviour Church, Јустинијан Први, 1050 Drachevo, North Macedonia",,,,,,
Саат Џамија;Bey Mahala,The Clock Mosque,Polog Region,Gostivar,Municipality of Gostivar,1230,,41.79527545,20.91094721,"The Clock Mosque, Boris Kirdich, 1230 Gostivar, North Macedonia",,,,,,
"Црква ""Свети Ѓорѓија""","Church ""Saint George""",Polog Region,Zdunje,Municipality of Gostivar,1230,,41.79202075,20.87804442,"Church Saint George""",,,"R29279, 1230 Zdunje, North Macedonia",266824490,,
Xhamia e Kadrit,,Polog Region,Gostivar,Municipality of Gostivar,1230,,41.79418043,20.8933393,"Jna, 1230 Gostivar, North Macedonia",,,,,,
"Црква ""Свети Никола""",Saint Nicolas Church,Polog Region,Mirdita,Municipality of Gostivar,1230,,41.75810505,20.87881021,"Saint Nicolas"" Church",,,"A2, 1230 Mirdita, North Macedonia",268394494,,
Црква Св. Атанасиј,,Polog Region,Brvenica,Municipality of Brvenica,1216,,41.96624295,20.98133307,"Црква Св. Атанасиј, R2233, 1216 Brvenica, North Macedonia",,,,,,
Xhamia e Loke,,Polog Region,Chegrane,Municipality of Gostivar,1237,,41.8345188,20.97063665,"Xhamia e Loke, R2233, 1237 Chegrane, North Macedonia",,,,,,
Xhamia në dalje të Çegranit,,Polog Region,Chegrane,Municipality of Gostivar,1237,,41.84541045,20.9786125,"Xhamia në dalje të Çegranit, R2233, 1237 Chegrane, North Macedonia",,,,,,
Џамија во Радиовце,,Polog Region,Radiovce,Municipality of Brvenica,1213,,41.90749555,20.96505893,"Џамија во Радиовце, 102, 1213 Radiovce, North Macedonia",,,,,,
Црква „Св. Никола“,,Polog Region,Tenovo,Municipality of Brvenica,1213,,41.89491345,20.98393414,"Црква „Св. Никола“, 102, 1213 Tenovo, North Macedonia",,,,,,
Стара џамија во Теново,,Polog Region,Tenovo,Municipality of Brvenica,1213,,41.8950092,20.98435509,"Стара џамија во Теново, 102, 1213 Tenovo, North Macedonia",,,,,,
Нова џамија во Теново,,Polog Region,Tenovo,Municipality of Brvenica,1213,,41.89213345,20.97855991,"Нова џамија во Теново, 102, 1213 Tenovo, North Macedonia",,,,,,
Света Троица,Holy Trinity,Pelagonia Region,Podvis,Municipality of Krivogashtani,,,41.3944488,21.32657285,"Holy Trinity, Dame Gruev, Podvis, North Macedonia",,,,,,
Св. Атанасиј Велики,,Pelagonia Region,Godivle,Municipality of Krivogashtani,7524,,41.3663968,21.31650603,"Св. Атанасиј Велики, Јане Сандански, 7524 Godivle, North Macedonia",,,,,,
Св. Константин и Елена,St. Constantine and Helen,Pelagonia Region,Prilep,Municipality of Prilep,7510,Tipski,41.3514694,21.56367985,"St. Constantine and Helen, Panko Brashnarov, 7510 Prilep, North Macedonia",,,,,,
Св. Атанасиј,,Pelagonia Region,Prilep,Municipality of Prilep,7500,Kozle,41.35937835,21.5325699,"Св. Атанасиј, Borka Lopach 0, 7500 Prilep, North Macedonia",,,,,,
Св. Архангел Михаил,St. Archangel Michael,Pelagonia Region,Prilep,Municipality of Prilep,7500,Kozle,41.36037695,21.53445404,"St. Archangel Michael, Borka Lopach 0, 7500 Prilep, North Macedonia",,,,,,
Св. Богородица,,Pelagonia Region,Prilep,Municipality of Prilep,7513,Kozle,41.35822835,21.53438865,"Св. Богородица, Borka Lopach, 7513 Prilep, North Macedonia",,,,,,
Св. Димитрија,,Pelagonia Region,Prilep,Municipality of Prilep,7513,Kozle,41.357881,21.5318083,"Св. Димитрија, Blagoja Shukuroski, 7513 Prilep, North Macedonia",,,,,,
Св. Петар и Павле,,Pelagonia Region,Prilep,Municipality of Prilep,7513,Kozle,41.35653385,21.53666662,"Св. Петар и Павле, Borka Lopach, 7513 Prilep, North Macedonia",,,,,,
Св. Никола,,Pelagonia Region,Prilep,Municipality of Prilep,7513,Kozle,41.3571657,21.53388545,"Св. Никола, Ilija Jovcheski, 7513 Prilep, North Macedonia",,,,,,
Св. Петка,St. Parascheva,Pelagonia Region,Lenishte,Municipality of Prilep,,,41.35884245,21.6270508,"St. Parascheva, R1101, Lenishte, North Macedonia",,,,,,
Манастир Св. Ѓорѓи,,Southeastern Region,Oraovica,Municipality of Radovish,2420,,41.64527175,22.50925227,"Манастир Св. Ѓорѓи, Илија Алексов, 2420 Oraovica, North Macedonia",,,,,,
Чебренски Манастир,,Pelagonia Region,Rapesh,Municipality of Novaci,,,41.1326711,21.67994828,"Чебренски Манастир, R1311, Rapesh, North Macedonia",,,,,,
Св. Атанасиј,,Pelagonia Region,Staravina,Municipality of Novaci,,,41.08600055,21.71906764,"Св. Атанасиј, R1311, Staravina, North Macedonia",,,,,,
Света Троица,Тhe church of the holly Trinity,Skopje Region,Bardovci,Municipality of Karposh,1060,,42.0292294,21.37830177,"Тhe church of the holly Trinity, Street 6, 1060 Bardovci, North Macedonia",,,,,,
Пресвета Богородица,Holy Mother of God,Southwestern Region,Makedonski Brod,Municipality of Makedonski Brod,6530,,41.51368015,21.21411975,"Holy Mother of God, Ilija Igeski-Cvetan, 6530 Makedonski Brod, North Macedonia",,,,,,
Тулбе,Tulbe,Southwestern Region,Makedonski Brod,Municipality of Makedonski Brod,6530,,41.5086055,21.21497909,"Tulbe, Porecka;Porečka 54, 6530 Makedonski Brod, North Macedonia",,,,,,
Турбе на Иса-бег,Tomb of Ishak Bey,Skopje Region,Skopje,Municipality of Chair,1001,Dukjandzhik,42.00242035,21.44143528,"Tomb of Ishak Bey, Васил Анџеларски, 1001 Skopje, North Macedonia",,,,,,
Покров на Пресвета Богородица,Shroud of the Most Holy Mother of God,Pelagonia Region,Prilep,Municipality of Prilep,7500,Shtavichko Maalo,41.3220951,21.5610036,"Shroud of the Most Holy Mother of God, Car Samoil, 7500 Prilep, North Macedonia",,,,,,
Рождество на Пресвета Богородица,Nativity of Virgin Mary,Pelagonia Region,Kadino Selo,Municipality of Prilep,,,41.3053214,21.45768987,"Nativity of Virgin Mary, R2339, Kadino Selo, North Macedonia",,,,,,
Св. Атанасиј,St. Athanasius,Pelagonia Region,Galichani,Municipality of Prilep,7515,,41.3035098,21.47059236,"St. Athanasius, R2339, 7515 Galichani, North Macedonia",,,,,,
Св.Талалеј,,Skopje Region,Arachinovo,Municipality of Arachinovo,1041,,42.02515045,21.5652379,"Св.Талалеј, Улица 1, 1041 Arachinovo, North Macedonia",,,,,,
Св. Јован Крстител,,Skopje Region,Skopje,Municipality of Aerodrom,1001,Novo Lisiche,41.9899259,21.47468825,"Св. Јован Крстител, Srbija, 1001 Skopje, North Macedonia",,,,,,
Св. Никола,St. Nicholas,Pelagonia Region,Sarandinovo,Municipality of Dolneni,,,41.4076239,21.39663953,"St. Nicholas, R1303, Sarandinovo, North Macedonia",,,,,,
Св. Троица,Holy Trinity,Pelagonia Region,Golemo Konjari,Municipality of Prilep,,,41.34156305,21.43697715,"Holy Trinity, R1306, Golemo Konjari, North Macedonia",,,,,,
Св. Пантелејмон,,Pelagonia Region,Beshishte,Municipality of Prilep,,,41.1364108,21.8069666,"Св. Пантелејмон, R2338, Beshishte, North Macedonia",,,,,,
Св. Димитриј,,Eastern Region,Shtip,Municipality of Shtip,2000,Кежовица,41.73441035,22.18118925,"Св. Димитриј, Krste Misirkov, 2000 Shtip, North Macedonia",,,,,,
Св. Богородица,,Eastern Region,Shtip,Municipality of Shtip,2000,Кежовица,41.7360819,22.182105,"Св. Богородица, Krste Misirkov, 2000 Shtip, North Macedonia",,,,,,
Св. Спас,,Eastern Region,Shtip,Municipality of Shtip,2000,Кежовица,41.7347907,22.1848158,"Св. Спас, Nikola Karev, 2000 Shtip, North Macedonia",,,,,,
Манастир „Свети Димитрија“,,Vardar Region,Veles,Municipality of Veles,1400,Babuna,41.7019638,21.79120236,"Манастир „Свети Димитрија“, R1102, 1400 Veles, North Macedonia",,,,,,
Св. Димитрија,,Polog Region,Gostivar,Municipality of Gostivar,1230,,41.7932068,20.9158082,"Св. Димитрија, Mara Ugirnoska, 1230 Gostivar, North Macedonia",,,,,,
Св. Димитриј Солунски,St. Demetrius of Salonica,Pelagonia Region,Trap,Municipality of Mogila,,,41.14121185,21.4357812,"St. Demetrius of Salonica, R29175, Trap, North Macedonia",,,,,,
Св. Атанасиј,St. Athanasius,Pelagonia Region,Pashino Ruvci,Municipality of Krivogashtani,7525,,41.2743076,21.36831554,"St. Athanasius, Ljube Grujoski, 7525 Pashino Ruvci, North Macedonia",,,,,,
Св. Георгиј,St. George,Pelagonia Region,Pashino Ruvci,Municipality of Krivogashtani,7525,,41.271358,21.39021372,"St. George, R2339, 7525 Pashino Ruvci, North Macedonia",,,,,,
Св. Петка,St. Parascheva,Northeastern Region,Voinovikj,Municipality of Kumanovo,,,42.2155793,21.69932307,"St. Parascheva, Friendship, Voinovikj, North Macedonia",,,,,,
Св.Никола,,Eastern Region,Shtip,Municipality of Shtip,2000,Кежовица,41.73663665,22.18890649,"Св.Никола, R1204, 2000 Shtip, North Macedonia",,,,,,
Мурат-пашина џамија,Murat Pasha Mosque,Skopje Region,Skopje,Municipality of Chair,1009,Dukjandzhik,42.00078735,21.43743807,"Murat Pasha Mosque, Битпазарска, 1009 Skopje, North Macedonia",,,,,,
Св. Никола,St. Nicholas,Pelagonia Region,Rashtani,Municipality of Bitola,7000,,41.05142,21.3247045,"St. Nicholas, A3, 7000 Rashtani, North Macedonia",,,,,,
Св. Арханѓел,,Eastern Region,Shtip,Municipality of Shtip,2000,Кежовица,41.7389336,22.18816526,"Св. Арханѓел, Пане Гочев, 2000 Shtip, North Macedonia",,,,,,
Кадан Ана Џамија,,Eastern Region,Shtip,Municipality of Shtip,2000,,41.73802014,22.19801625,"General Mihaylo Apostolski St., 2000 Shtip, North Macedonia",,,,,,
Св. Архангел Михаил,,Eastern Region,Shtip,Municipality of Shtip,2000,Кежовица,41.7380907,22.19129535,"Св. Архангел Михаил, Иво Лола Рибар, 2000 Shtip, North Macedonia",,,,,,
Св. Атанасиј Велики,St. Athanasius,Eastern Region,Orizari,Municipality of Kochani,2300,,41.9221786,22.4468081,"St. Athanasius, Gotse Delchev Str., 2300 Orizari, North Macedonia",,,,,,
Св. Атанасиј,St. Athanasius,Polog Region,Sarakjino,Municipality of Tetovo,,,41.9816694,21.03900105,"St. Athanasius, R1206, Sarakjino, North Macedonia",,,,,,
Пресвета Богородица,Holy Mother of God,Polog Region,Sarakjino,Municipality of Tetovo,,,41.98076845,21.04121195,"Holy Mother of God, R1206, Sarakjino, North Macedonia",,,,,,
св. Тројица,Sv. Trojitca,Skopje Region,Banjane,Municipality of Chucher Sandevo,,,42.1027654,21.37854295,"Sv. Trojitca, Манастир Св. Илија, Banjane, North Macedonia",,,,,,
Xhamia e Cairit,,Skopje Region,Skopje,Municipality of Chair,1009,Топанско Поле,42.01887835,21.44511715,"Xhamia e Cairit, Teki Derishi, 1009 Skopje, North Macedonia",,,,,,
Xhamia e Uhudit,,Skopje Region,Skopje,Municipality of Chair,1009,Топанско Поле,42.01862725,21.4383825,"Xhamia e Uhudit, Дижонска 83, 1009 Skopje, North Macedonia",,,,,,
Хаџиќазимова џамија,,Skopje Region,Skopje,Municipality of Chair,1001,Dukjandzhik,42.00361155,21.44519637,"Хаџиќазимова џамија, Челопек, 1001 Skopje, North Macedonia",,,,,,
Sv. Mala Bogorodica,,Skopje Region,Kuchkovo,Municipality of Gjorche Petrov,1060,,42.0385762,21.3307823,"Sv. Mala Bogorodica, Mother Teresa, 1060 Kuchkovo, North Macedonia",,,,,,
Кебир Мехмед Челеби џамија,,Skopje Region,Skopje,Municipality of Centar,1001,Centar,41.9993074,21.4452542,"Кебир Мехмед Челеби џамија, Штипска, 1001 Skopje, North Macedonia",,,,,,
Sveto Prepolovenie Rusa Sreda,Sveto Prepolovenie Rusa Sreda,Skopje Region,Batinci,Municipality of Studenichani,1050,Ljubosh,41.9168077,21.49535085,"Sveto Prepolovenie Rusa Sreda, Улица 8, 1050 Batinci, North Macedonia",,,,,,
Manastir Sv. Spas,,Vardar Region,Kavadarci,Municipality of Kavadarci,1430,,41.445737,21.9811109,"Manastir Sv. Spas, R1103, 1430 Kavadarci, North Macedonia",,,,,,
св. Софија аеродром,,Skopje Region,Skopje,Municipality of Aerodrom,1001,Novo Lisiche,41.98083715,21.47361115,"св. Софија аеродром, Видое Смилевски-Бато, 1001 Skopje, North Macedonia",,,,,,
Црква Свети Никола - Аеродром,Saint Nicholas,Skopje Region,Skopje,Municipality of Aerodrom,1001,Jane Sandanski,41.98379065,21.47145191,"Saint Nicholas, Булевар Јане Сандански, 1001 Skopje, North Macedonia",,,,,,
Рождество на Пресвета Богородица,Nativity of the Virgin Mary,Pelagonia Region,Malo Konjari,Municipality of Prilep,,,41.3331612,21.4619236,"Nativity of the Virgin Mary, R1306, Malo Konjari, North Macedonia",,,,,,
Xhamia e Re,,Northeastern Region,Kumanovo,Municipality of Kumanovo,1300,,42.1265567,21.70901556,"Xhamia e Re, Pero Stojmanovski, 1300 Kumanovo, North Macedonia",,,,,,
Св. Георгиј,St. George,Pelagonia Region,Prisad,Municipality of Prilep,,,41.42871355,21.62006505,"St. George, R1312, Prisad, North Macedonia",,,,,,
Св. Никола,,Pelagonia Region,Vogjani,Municipality of Krivogashtani,7525,,41.28420415,21.3385586,"Св. Никола, Најдо Најдоски, 7525 Vogjani, North Macedonia",,,,,,
Св. Архангел Гаврил,,Skopje Region,Skopje,Municipality of Gjorche Petrov,1060,Dame Gruev,42.0234766,21.3427234,"Св. Архангел Гаврил, Лука Геров, 1060 Skopje, North Macedonia",,,,,,
Евангелска Конгрешанска Црква,,Skopje Region,Skopje,Municipality of Centar,1000,Kapishtec,41.9983498,21.41490282,"Евангелска Конгрешанска Црква, Hristo Smirnenski, 1000 Skopje, North Macedonia",,,,,,
Св. Илија,St. Eliyah,Pelagonia Region,Veselchani,Municipality of Prilep,7512,,41.2707346,21.4440719,"St. Eliyah, R1101, 7512 Veselchani, North Macedonia",,,,,,
Св. Јован Крстител,St. John the Baptist,Pelagonia Region,Oreovec,Municipality of Prilep,7510,,41.36643295,21.59850961,"St. John the Baptist, Prilep-Gradsko, 7510 Oreovec, North Macedonia",,,,,,
Св. Павле,St. Oaul,Eastern Region,Vinica,Municipality of Vinica,2310,,41.88453865,22.50502826,"St. Oaul, Angel of Vinica, 2310 Vinica, North Macedonia",,,,,,
Св. Архангел Миахил,St. Archangel Michael,Pelagonia Region,Kalen,Municipality of Prilep,,,41.2919043,21.62518705,"St. Archangel Michael, R1107, Kalen, North Macedonia",,,,,,
Св.Илија,,Eastern Region,Shtip,Municipality of Shtip,2000,Кежовица,41.73573435,22.19551821,"Св.Илија, Ленинова, 2000 Shtip, North Macedonia",,,,,,
En-Nur Mosque,,Skopje Region,Bukovikj,Municipality of Saraj,,,41.9732352,21.2385472,"En-Nur Mosque, R1206, Bukovikj, North Macedonia",,,,,,
SV Petka,,Skopje Region,Divlje,Municipality of Petrovec,,,41.92117855,21.76202715,"SV Petka, R105, Divlje, North Macedonia",,,,,,
Храм Св. Троица,Holy Trinity Church,Southwestern Region,Belica,Municipality of Makedonski Brod,,,41.6748482,21.31190495,"Holy Trinity Church, Belica, Southwestern Region, North Macedonia",,,,,,
Sv. Bogorodica,,Vardar Region,Nemanjici,Municipality of Sveti Nikole,,,41.91389825,22.01334285,"Sv. Bogorodica, R2236, Nemanjici, North Macedonia",,,,,,
Св. Никола,St. Nicholas,Pelagonia Region,Shtavica,Municipality of Prilep,,,41.29017695,21.59672447,"St. Nicholas, R1107, Shtavica, North Macedonia",,,,,,
Св. Георгиј,,Pelagonia Region,Buchin,Municipality of Krushevo,7525,,41.2745032,21.29211954,"Св. Георгиј, R2339, 7525 Buchin, North Macedonia",,,,,,
Св. Архангел Михаил,,Southwestern Region,Lokvica,Municipality of Makedonski Brod,6530,,41.54682845,21.25005901,"Св. Архангел Михаил, R1106, 6530 Lokvica, North Macedonia",,,,,,
Св. Илија,,Pelagonia Region,Kalen,Municipality of Prilep,,,41.24839285,21.6078234,"Св. Илија, R1107, Kalen, North Macedonia",,,,,,
Св. Недела,St. Domenica,Pelagonia Region,Dunje,Municipality of Prilep,,,41.1977032,21.6701648,"St. Domenica, R1107, Dunje, North Macedonia",,,,,,
Св. Петар и Павле,St. Peter and Paul,Pelagonia Region,Dunje,Municipality of Prilep,,,41.2473974,21.6694508,"St. Peter and Paul, R1107, Dunje, North Macedonia",,,,,,
Св. Георгиј,Church St. George,Pelagonia Region,Dunje,Municipality of Prilep,,,41.22014355,21.6862205,"Church St. George, R1107, Dunje, North Macedonia",,,,,,
Св. Преображение,,Pelagonia Region,Krushevo OT,Municipality of Krushevo,7550,,41.40811945,21.22094657,"Св. Преображение, Krst Bozhji, 7550 Krushevo OT, North Macedonia",,,,,,
Св. Илија,,Pelagonia Region,Krushevo OT,Municipality of Krushevo,7550,Gipsy Neighbourhood,41.3113797,21.26943102,"Св. Илија, R1306, 7550 Krushevo OT, North Macedonia",,,,,,
Св. Георгиј,St. George,Pelagonia Region,Ostrilci,Municipality of Krushevo,7550,,41.32871745,21.23538683,"St. George, R1306, 7550 Ostrilci, North Macedonia",,,,,,
Св. Никола,,Pelagonia Region,Berovci,Municipality of Prilep,7515,,41.29620315,21.48754745,"Св. Никола, R2339, 7515 Berovci, North Macedonia",,,,,,
Св. Недела,St. Sunday,Southwestern Region,Drugovo,Municipality of Kichevo,6261,,41.4841715,20.92338911,"St. Sunday, Гоце Делчев, 6261 Drugovo, North Macedonia",,,,,,
Св. Атанасиј,St. Athanasius,Pelagonia Region,Lenishte,Municipality of Prilep,7510,,41.362435,21.61955335,"St. Athanasius, R1101, 7510 Lenishte, North Macedonia",,,,,,
Св. Троица,Holy Trinity,Vardar Region,Rosoman,Municipality of Rosoman,1422,,41.5180287,21.94543601,"Holy Trinity, L10701, 1422 Rosoman, North Macedonia",,,,,,
Манастир Свети Ѓорѓи - Кнежино,,Southwestern Region,Knezhino,Municipality of Kichevo,6261,,41.51619265,20.92154529,"Манастир Свети Ѓорѓи - Кнежино, Патека до манастир Св. Ѓорѓи (Кнежино), 6261 Knezhino, North Macedonia",,,,,,
Свети Димитрија,,Southwestern Region,Knezhino,Municipality of Kichevo,6261,,41.5212624,20.91664401,"Свети Димитрија, Кнежино, 6261 Knezhino, North Macedonia",,,,,,
Св. Архангел Михаил,,Southwestern Region,:Lavchani,Municipality of Kichevo,6261,,41.48302375,20.86723133,"6261 :Lavchani, North Macedonia",,,,,,
Св. Никола,St. Nicholas,Pelagonia Region,Zheleznec,Municipality of Demir Hisar/Murgashevo,,,41.29780345,21.0721115,"St. Nicholas, R1305, Zheleznec, North Macedonia",,,,,,
Св. Петка,St. Parascheva,Pelagonia Region,Prilep,Municipality of Prilep,7500,Tochila,41.34812925,21.53842896,"St. Parascheva, Brakja Miladinovci 0, 7500 Prilep, North Macedonia",,,,,,
Св. Атанасиј,St. Athanasius,Pelagonia Region,Zheleznec,Municipality of Demir Hisar/Murgashevo,,,41.2828107,21.04652866,"St. Athanasius, R1305, Zheleznec, North Macedonia",,,,,,
Рождество на Пресвета Богородица,Nativity of the Virgin Mary,Pelagonia Region,Barakovo,Municipality of Demir Hisar/Murgashevo,7240,,41.25094535,21.2263374,"Nativity of the Virgin Mary, R512, 7240 Barakovo, North Macedonia",,,,,,
Св. Никола,St. Nicholas,Pelagonia Region,Belche,Municipality of Demir Hisar/Murgashevo,7240,,41.24459455,21.1965553,"St. Nicholas, R1305, 7240 Belche, North Macedonia",,,,,,
Св. Богородица - Пречиста Кичевска,,Southwestern Region,Manastirsko Dolenci,Municipality of Kichevo,6261,,41.45918985,20.93541951,"Св. Богородица - Пречиста Кичевска, R1305, 6261 Manastirsko Dolenci, North Macedonia",,,,,,
Св. Георгиј,St. George,Pelagonia Region,Zashle,Municipality of Demir Hisar/Murgashevo,,,41.3404335,21.1264776,"St. George, Цер - Зашле, Zashle, North Macedonia",,,,,,
Св. Константин и Св. Елена,St. Constantine and St. Elena,Pelagonia Region,Edinakovci,Municipality of Demir Hisar/Murgashevo,,,41.23488085,21.25097585,"St. Constantine and St. Elena, R512, Edinakovci, North Macedonia",,,,,,
Gorno Orizari Mosque,,Vardar Region,Gorno Orizari,Municipality of Veles,1400,,41.68590605,21.73318095,"Gorno Orizari Mosque, 10124, 1400 Gorno Orizari, North Macedonia",,,,,,
Laka Mosque,,Skopje Region,Skopje,Municipality of Gjorche Petrov,9100,Hrom,41.9975331,21.36628138,"Laka Mosque, Рафаел Батино, 9100 Skopje, North Macedonia",,,,,,
Taftalidzhe Mosque,,Skopje Region,Skopje,Municipality of Karposh,9100,Taftalidzhe 2,42.00313065,21.38345186,"Taftalidzhe Mosque, Демир Трајко, 9100 Skopje, North Macedonia",,,,,,
